[
  {
    "versionDir": "v20250927-2103-66271171",
    "baseComponent": "GeneratedComponent",
    "runTimestamp": "2025-09-27T20:03:07.419Z",
    "previousVersionDir": null,
    "fileHashes": {
      "GeneratedComponent.v1.tsx": "2e12b032"
    }
  },
  {
    "versionDir": "v20250927-2126-ae0e4296",
    "baseComponent": "GeneratedComponent",
    "runTimestamp": "2025-09-27T20:26:35.003Z",
    "previousVersionDir": "v20250927-2103-66271171",
    "fileHashes": {
      "GeneratedComponent.v1.tsx": "2e12b032"
    }
  },
  {
    "versionDir": "v20250928-1353-a275d59e",
    "baseComponent": "GeneratedComponent",
    "runTimestamp": "2025-09-28T12:53:57.322Z",
    "previousVersionDir": "v20250927-2126-ae0e4296",
    "fileHashes": {
      "GeneratedComponent.v1.tsx": "2e12b032"
    }
  },
  {
    "versionDir": "v20250928-1359-13827590",
    "baseComponent": "GeneratedComponent",
    "runTimestamp": "2025-09-28T12:59:24.431Z",
    "previousVersionDir": "v20250928-1353-a275d59e",
    "fileHashes": {
      "GeneratedComponent.v1.tsx": "2e12b032"
    }
  },
  {
    "versionDir": "v20250928-1402-3830b98a",
    "baseComponent": "GeneratedComponent",
    "runTimestamp": "2025-09-28T13:02:06.546Z",
    "previousVersionDir": "v20250928-1359-13827590",
    "fileHashes": {
      "GeneratedComponent.v1.tsx": "2e12b032"
    }
  },
  {
    "versionDir": "v20250928-1403-ffeba6f6",
    "baseComponent": "GeneratedComponent",
    "runTimestamp": "2025-09-28T13:03:11.109Z",
    "previousVersionDir": "v20250928-1402-3830b98a",
    "fileHashes": {
      "GeneratedComponent.v1.tsx": "2e12b032"
    }
  },
  {
    "versionDir": "v20250928-1706-832b1029",
    "baseComponent": "GeneratedComponent",
    "runTimestamp": "2025-09-28T16:06:32.565Z",
    "previousVersionDir": "v20250928-1403-ffeba6f6",
    "fileHashes": {
      "GeneratedComponent.v1.tsx": "2e12b032"
    }
  },
  {
    "versionDir": "v20250929-1448-23d3b997",
    "baseComponent": "GeneratedComponent",
    "runTimestamp": "2025-09-29T14:48:32.875Z",
    "previousVersionDir": "v20250928-1706-832b1029",
    "fileHashes": {
      "GeneratedComponent.v1.tsx": "2e12b032"
    }
  },
  {
    "versionDir": "v20250929-1450-aed6cd3c",
    "baseComponent": "GeneratedComponent",
    "runTimestamp": "2025-09-29T14:50:28.410Z",
    "previousVersionDir": "v20250929-1448-23d3b997",
    "fileHashes": {
      "GeneratedComponent.v1.tsx": "2e12b032"
    }
  },
  {
    "versionDir": "v20250929-1547-a467f28e",
    "baseComponent": "GeneratedComponent",
    "runTimestamp": "2025-09-29T15:47:44.351Z",
    "previousVersionDir": "v20250929-1450-aed6cd3c",
    "fileHashes": {
      "GeneratedComponent.v1.tsx": "2e12b032"
    }
  }
]