[
  {
    "versionDir": "v20250927-2116-f40cdf59",
    "baseComponent": "GeneratedComponent",
    "runTimestamp": "2025-09-27T20:16:34.946Z",
    "previousVersionDir": null,
    "fileHashes": {
      "GeneratedComponent.v1.tsx": "535cac96"
    }
  },
  {
    "versionDir": "v20250927-2121-2b99736a",
    "baseComponent": "GeneratedComponent",
    "runTimestamp": "2025-09-27T20:21:57.339Z",
    "previousVersionDir": "v20250927-2116-f40cdf59",
    "fileHashes": {
      "GeneratedComponent.v1.tsx": "535cac96"
    }
  },
  {
    "versionDir": "v20250927-2124-e8d19c47",
    "baseComponent": "GeneratedComponent",
    "runTimestamp": "2025-09-27T20:24:41.412Z",
    "previousVersionDir": "v20250927-2121-2b99736a",
    "fileHashes": {
      "GeneratedComponent.v1.tsx": "535cac96"
    }
  },
  {
    "versionDir": "v20250927-2126-8e634aac",
    "baseComponent": "GeneratedComponent",
    "runTimestamp": "2025-09-27T20:26:34.444Z",
    "previousVersionDir": "v20250927-2124-e8d19c47",
    "fileHashes": {
      "GeneratedComponent.v1.tsx": "535cac96"
    }
  },
  {
    "versionDir": "v20250928-1250-2cc6f0df",
    "baseComponent": "GeneratedComponent",
    "runTimestamp": "2025-09-28T11:50:44.164Z",
    "previousVersionDir": "v20250927-2126-8e634aac",
    "fileHashes": {
      "GeneratedComponent.v1.tsx": "535cac96"
    }
  },
  {
    "versionDir": "v20250928-1253-7e7bf983",
    "baseComponent": "GeneratedComponent",
    "runTimestamp": "2025-09-28T11:53:15.509Z",
    "previousVersionDir": "v20250928-1250-2cc6f0df",
    "fileHashes": {
      "GeneratedComponent.v1.tsx": "535cac96"
    }
  },
  {
    "versionDir": "v20250928-1255-53dc6b7e",
    "baseComponent": "GeneratedComponent",
    "runTimestamp": "2025-09-28T11:55:27.494Z",
    "previousVersionDir": "v20250928-1253-7e7bf983",
    "fileHashes": {
      "GeneratedComponent.v1.tsx": "535cac96"
    }
  },
  {
    "versionDir": "v20250928-1255-d3b02c52",
    "baseComponent": "GeneratedComponent",
    "runTimestamp": "2025-09-28T11:55:42.892Z",
    "previousVersionDir": "v20250928-1255-53dc6b7e",
    "fileHashes": {
      "GeneratedComponent.v1.tsx": "535cac96"
    }
  },
  {
    "versionDir": "v20250928-1256-de2bcf2e",
    "baseComponent": "GeneratedComponent",
    "runTimestamp": "2025-09-28T11:56:06.706Z",
    "previousVersionDir": "v20250928-1255-d3b02c52",
    "fileHashes": {
      "GeneratedComponent.v1.tsx": "535cac96"
    }
  },
  {
    "versionDir": "v20250928-1353-f35bf503",
    "baseComponent": "GeneratedComponent",
    "runTimestamp": "2025-09-28T12:53:58.399Z",
    "previousVersionDir": "v20250928-1256-de2bcf2e",
    "fileHashes": {
      "GeneratedComponent.v1.tsx": "535cac96"
    }
  },
  {
    "versionDir": "v20250928-1359-3a570dac",
    "baseComponent": "GeneratedComponent",
    "runTimestamp": "2025-09-28T12:59:24.125Z",
    "previousVersionDir": "v20250928-1353-f35bf503",
    "fileHashes": {
      "GeneratedComponent.v1.tsx": "535cac96"
    }
  },
  {
    "versionDir": "v20250928-1402-43ac20e0",
    "baseComponent": "GeneratedComponent",
    "runTimestamp": "2025-09-28T13:02:06.097Z",
    "previousVersionDir": "v20250928-1359-3a570dac",
    "fileHashes": {
      "GeneratedComponent.v1.tsx": "535cac96"
    }
  },
  {
    "versionDir": "v20250928-1403-26d142fd",
    "baseComponent": "GeneratedComponent",
    "runTimestamp": "2025-09-28T13:03:10.886Z",
    "previousVersionDir": "v20250928-1402-43ac20e0",
    "fileHashes": {
      "GeneratedComponent.v1.tsx": "535cac96"
    }
  },
  {
    "versionDir": "v20250928-1706-43bba93f",
    "baseComponent": "GeneratedComponent",
    "runTimestamp": "2025-09-28T16:06:32.494Z",
    "previousVersionDir": "v20250928-1403-26d142fd",
    "fileHashes": {
      "GeneratedComponent.v1.tsx": "535cac96"
    }
  },
  {
    "versionDir": "v20250929-1448-adb218cb",
    "baseComponent": "GeneratedComponent",
    "runTimestamp": "2025-09-29T14:48:33.796Z",
    "previousVersionDir": "v20250928-1706-43bba93f",
    "fileHashes": {
      "GeneratedComponent.v1.tsx": "535cac96"
    }
  },
  {
    "versionDir": "v20250929-1450-98435883",
    "baseComponent": "GeneratedComponent",
    "runTimestamp": "2025-09-29T14:50:28.492Z",
    "previousVersionDir": "v20250929-1448-adb218cb",
    "fileHashes": {
      "GeneratedComponent.v1.tsx": "535cac96"
    }
  }
]