[
  {
    "versionDir": "v20250927-2059-aded56c4",
    "baseComponent": "GeneratedComponent",
    "runTimestamp": "2025-09-27T19:59:48.258Z",
    "previousVersionDir": null,
    "fileHashes": {
      "GeneratedComponent.v1.tsx": "535cac96"
    }
  },
  {
    "versionDir": "v20250927-2059-e825c9b1",
    "baseComponent": "GeneratedComponent",
    "runTimestamp": "2025-09-27T19:59:48.264Z",
    "previousVersionDir": "v20250927-2059-aded56c4",
    "fileHashes": {
      "GeneratedComponent.v1.tsx": "40c04602"
    }
  },
  {
    "versionDir": "v20250927-2059-9c6d1cd8",
    "baseComponent": "GeneratedComponent",
    "runTimestamp": "2025-09-27T19:59:48.270Z",
    "previousVersionDir": "v20250927-2059-e825c9b1",
    "fileHashes": {
      "GeneratedComponent.v1.tsx": "535cac96"
    }
  },
  {
    "versionDir": "v20250927-2126-73f580e5",
    "baseComponent": "GeneratedComponent",
    "runTimestamp": "2025-09-27T20:26:34.535Z",
    "previousVersionDir": "v20250927-2059-9c6d1cd8",
    "fileHashes": {
      "GeneratedComponent.v1.tsx": "535cac96"
    }
  },
  {
    "versionDir": "v20250927-2126-1d18e876",
    "baseComponent": "GeneratedComponent",
    "runTimestamp": "2025-09-27T20:26:34.561Z",
    "previousVersionDir": "v20250927-2126-73f580e5",
    "fileHashes": {
      "GeneratedComponent.v1.tsx": "40c04602"
    }
  },
  {
    "versionDir": "v20250927-2126-438d7531",
    "baseComponent": "GeneratedComponent",
    "runTimestamp": "2025-09-27T20:26:34.618Z",
    "previousVersionDir": "v20250927-2126-1d18e876",
    "fileHashes": {
      "GeneratedComponent.v1.tsx": "535cac96"
    }
  },
  {
    "versionDir": "v20250928-1353-1bf7fb66",
    "baseComponent": "GeneratedComponent",
    "runTimestamp": "2025-09-28T12:53:56.970Z",
    "previousVersionDir": "v20250927-2126-438d7531",
    "fileHashes": {
      "GeneratedComponent.v1.tsx": "535cac96"
    }
  },
  {
    "versionDir": "v20250928-1353-8f9ef768",
    "baseComponent": "GeneratedComponent",
    "runTimestamp": "2025-09-28T12:53:56.980Z",
    "previousVersionDir": "v20250928-1353-1bf7fb66",
    "fileHashes": {
      "GeneratedComponent.v1.tsx": "40c04602"
    }
  },
  {
    "versionDir": "v20250928-1353-2dd6faa4",
    "baseComponent": "GeneratedComponent",
    "runTimestamp": "2025-09-28T12:53:56.992Z",
    "previousVersionDir": "v20250928-1353-8f9ef768",
    "fileHashes": {
      "GeneratedComponent.v1.tsx": "535cac96"
    }
  },
  {
    "versionDir": "v20250928-1359-3204275a",
    "baseComponent": "GeneratedComponent",
    "runTimestamp": "2025-09-28T12:59:25.261Z",
    "previousVersionDir": "v20250928-1353-2dd6faa4",
    "fileHashes": {
      "GeneratedComponent.v1.tsx": "535cac96"
    }
  },
  {
    "versionDir": "v20250928-1359-dee99ea0",
    "baseComponent": "GeneratedComponent",
    "runTimestamp": "2025-09-28T12:59:25.268Z",
    "previousVersionDir": "v20250928-1359-3204275a",
    "fileHashes": {
      "GeneratedComponent.v1.tsx": "40c04602"
    }
  },
  {
    "versionDir": "v20250928-1359-3f3a61b6",
    "baseComponent": "GeneratedComponent",
    "runTimestamp": "2025-09-28T12:59:25.275Z",
    "previousVersionDir": "v20250928-1359-dee99ea0",
    "fileHashes": {
      "GeneratedComponent.v1.tsx": "535cac96"
    }
  },
  {
    "versionDir": "v20250928-1402-88df69b1",
    "baseComponent": "GeneratedComponent",
    "runTimestamp": "2025-09-28T13:02:06.231Z",
    "previousVersionDir": "v20250928-1359-3f3a61b6",
    "fileHashes": {
      "GeneratedComponent.v1.tsx": "535cac96"
    }
  },
  {
    "versionDir": "v20250928-1402-6e5a3311",
    "baseComponent": "GeneratedComponent",
    "runTimestamp": "2025-09-28T13:02:06.259Z",
    "previousVersionDir": "v20250928-1402-88df69b1",
    "fileHashes": {
      "GeneratedComponent.v1.tsx": "40c04602"
    }
  },
  {
    "versionDir": "v20250928-1402-fd4ca051",
    "baseComponent": "GeneratedComponent",
    "runTimestamp": "2025-09-28T13:02:06.328Z",
    "previousVersionDir": "v20250928-1402-6e5a3311",
    "fileHashes": {
      "GeneratedComponent.v1.tsx": "535cac96"
    }
  },
  {
    "versionDir": "v20250928-1403-dba55589",
    "baseComponent": "GeneratedComponent",
    "runTimestamp": "2025-09-28T13:03:11.031Z",
    "previousVersionDir": "v20250928-1402-fd4ca051",
    "fileHashes": {
      "GeneratedComponent.v1.tsx": "535cac96"
    }
  },
  {
    "versionDir": "v20250928-1403-fdd913fe",
    "baseComponent": "GeneratedComponent",
    "runTimestamp": "2025-09-28T13:03:11.062Z",
    "previousVersionDir": "v20250928-1403-dba55589",
    "fileHashes": {
      "GeneratedComponent.v1.tsx": "40c04602"
    }
  },
  {
    "versionDir": "v20250928-1403-61d82a3e",
    "baseComponent": "GeneratedComponent",
    "runTimestamp": "2025-09-28T13:03:11.089Z",
    "previousVersionDir": "v20250928-1403-fdd913fe",
    "fileHashes": {
      "GeneratedComponent.v1.tsx": "535cac96"
    }
  },
  {
    "versionDir": "v20250928-1706-8b1063c4",
    "baseComponent": "GeneratedComponent",
    "runTimestamp": "2025-09-28T16:06:32.364Z",
    "previousVersionDir": "v20250928-1403-61d82a3e",
    "fileHashes": {
      "GeneratedComponent.v1.tsx": "535cac96"
    }
  },
  {
    "versionDir": "v20250928-1706-d89ede9b",
    "baseComponent": "GeneratedComponent",
    "runTimestamp": "2025-09-28T16:06:32.384Z",
    "previousVersionDir": "v20250928-1706-8b1063c4",
    "fileHashes": {
      "GeneratedComponent.v1.tsx": "40c04602"
    }
  },
  {
    "versionDir": "v20250928-1706-1e227330",
    "baseComponent": "GeneratedComponent",
    "runTimestamp": "2025-09-28T16:06:32.456Z",
    "previousVersionDir": "v20250928-1706-d89ede9b",
    "fileHashes": {
      "GeneratedComponent.v1.tsx": "535cac96"
    }
  }
]