[
  {
    "versionDir": "v20250928-1353-35b811f7",
    "baseComponent": "GeneratedComponent",
    "runTimestamp": "2025-09-28T12:53:57.043Z",
    "previousVersionDir": null,
    "fileHashes": {
      "GeneratedComponent.v1.tsx": "7dbb1e34"
    }
  },
  {
    "versionDir": "v20250928-1359-44ebf64e",
    "baseComponent": "GeneratedComponent",
    "runTimestamp": "2025-09-28T12:59:24.614Z",
    "previousVersionDir": "v20250928-1353-35b811f7",
    "fileHashes": {
      "GeneratedComponent.v1.tsx": "7dbb1e34"
    }
  },
  {
    "versionDir": "v20250928-1402-fe02b323",
    "baseComponent": "GeneratedComponent",
    "runTimestamp": "2025-09-28T13:02:07.053Z",
    "previousVersionDir": "v20250928-1359-44ebf64e",
    "fileHashes": {
      "GeneratedComponent.v1.tsx": "7dbb1e34"
    }
  },
  {
    "versionDir": "v20250928-1403-7d2b1541",
    "baseComponent": "GeneratedComponent",
    "runTimestamp": "2025-09-28T13:03:10.460Z",
    "previousVersionDir": "v20250928-1402-fe02b323",
    "fileHashes": {
      "GeneratedComponent.v1.tsx": "7dbb1e34"
    }
  },
  {
    "versionDir": "v20250928-1706-c07201db",
    "baseComponent": "GeneratedComponent",
    "runTimestamp": "2025-09-28T16:06:33.237Z",
    "previousVersionDir": "v20250928-1403-7d2b1541",
    "fileHashes": {
      "GeneratedComponent.v1.tsx": "7dbb1e34"
    }
  },
  {
    "versionDir": "v20250929-1448-b73cd119",
    "baseComponent": "GeneratedComponent",
    "runTimestamp": "2025-09-29T14:48:33.969Z",
    "previousVersionDir": "v20250928-1706-c07201db",
    "fileHashes": {
      "GeneratedComponent.v1.tsx": "7dbb1e34"
    }
  },
  {
    "versionDir": "v20250929-1450-e16ca5e4",
    "baseComponent": "GeneratedComponent",
    "runTimestamp": "2025-09-29T14:50:28.785Z",
    "previousVersionDir": "v20250929-1448-b73cd119",
    "fileHashes": {
      "GeneratedComponent.v1.tsx": "7dbb1e34"
    }
  },
  {
    "versionDir": "v20250929-1547-5e683b62",
    "baseComponent": "GeneratedComponent",
    "runTimestamp": "2025-09-29T15:47:45.893Z",
    "previousVersionDir": "v20250929-1450-e16ca5e4",
    "fileHashes": {
      "GeneratedComponent.v1.tsx": "7dbb1e34"
    }
  }
]