[
  {
    "versionDir": "v20250927-2126-ffda73cf",
    "baseComponent": "GeneratedComponent",
    "runTimestamp": "2025-09-27T20:26:35.186Z",
    "previousVersionDir": null,
    "fileHashes": {
      "GeneratedComponent.v1.tsx": "535cac96"
    }
  },
  {
    "versionDir": "v20250928-1353-5a628d43",
    "baseComponent": "GeneratedComponent",
    "runTimestamp": "2025-09-28T12:53:56.338Z",
    "previousVersionDir": "v20250927-2126-ffda73cf",
    "fileHashes": {
      "GeneratedComponent.v1.tsx": "535cac96"
    }
  },
  {
    "versionDir": "v20250928-1359-e7e21a5a",
    "baseComponent": "GeneratedComponent",
    "runTimestamp": "2025-09-28T12:59:23.217Z",
    "previousVersionDir": "v20250928-1353-5a628d43",
    "fileHashes": {
      "GeneratedComponent.v1.tsx": "535cac96"
    }
  }
]