[
  {
    "versionDir": "v20250928-1353-4895f1bd",
    "baseComponent": "GeneratedComponent",
    "runTimestamp": "2025-09-28T12:53:56.583Z",
    "previousVersionDir": null,
    "fileHashes": {
      "GeneratedComponent.v1.tsx": "7dbb1e34"
    }
  },
  {
    "versionDir": "v20250928-1359-72d5148c",
    "baseComponent": "GeneratedComponent",
    "runTimestamp": "2025-09-28T12:59:24.405Z",
    "previousVersionDir": "v20250928-1353-4895f1bd",
    "fileHashes": {
      "GeneratedComponent.v1.tsx": "7dbb1e34"
    }
  },
  {
    "versionDir": "v20250928-1402-30f32105",
    "baseComponent": "GeneratedComponent",
    "runTimestamp": "2025-09-28T13:02:06.655Z",
    "previousVersionDir": "v20250928-1359-72d5148c",
    "fileHashes": {
      "GeneratedComponent.v1.tsx": "7dbb1e34"
    }
  },
  {
    "versionDir": "v20250928-1403-5ac2c60e",
    "baseComponent": "GeneratedComponent",
    "runTimestamp": "2025-09-28T13:03:11.582Z",
    "previousVersionDir": "v20250928-1402-30f32105",
    "fileHashes": {
      "GeneratedComponent.v1.tsx": "7dbb1e34"
    }
  },
  {
    "versionDir": "v20250928-1706-48d6a614",
    "baseComponent": "GeneratedComponent",
    "runTimestamp": "2025-09-28T16:06:32.777Z",
    "previousVersionDir": "v20250928-1403-5ac2c60e",
    "fileHashes": {
      "GeneratedComponent.v1.tsx": "7dbb1e34"
    }
  },
  {
    "versionDir": "v20250929-1448-e301f9b4",
    "baseComponent": "GeneratedComponent",
    "runTimestamp": "2025-09-29T14:48:33.487Z",
    "previousVersionDir": "v20250928-1706-48d6a614",
    "fileHashes": {
      "GeneratedComponent.v1.tsx": "7dbb1e34"
    }
  },
  {
    "versionDir": "v20250929-1450-f619860c",
    "baseComponent": "GeneratedComponent",
    "runTimestamp": "2025-09-29T14:50:28.677Z",
    "previousVersionDir": "v20250929-1448-e301f9b4",
    "fileHashes": {
      "GeneratedComponent.v1.tsx": "7dbb1e34"
    }
  },
  {
    "versionDir": "v20250929-1547-b40b02f1",
    "baseComponent": "GeneratedComponent",
    "runTimestamp": "2025-09-29T15:47:45.244Z",
    "previousVersionDir": "v20250929-1450-f619860c",
    "fileHashes": {
      "GeneratedComponent.v1.tsx": "7dbb1e34"
    }
  }
]