[
  {
    "versionDir": "v20250927-2116-763f4d07",
    "baseComponent": "GeneratedComponent",
    "runTimestamp": "2025-09-27T20:16:34.440Z",
    "previousVersionDir": null,
    "fileHashes": {
      "GeneratedComponent.v1.tsx": "535cac96"
    }
  },
  {
    "versionDir": "v20250927-2116-a77e098c",
    "baseComponent": "GeneratedComponent",
    "runTimestamp": "2025-09-27T20:16:34.447Z",
    "previousVersionDir": "v20250927-2116-763f4d07",
    "fileHashes": {
      "GeneratedComponent.v1.tsx": "535cac96"
    }
  },
  {
    "versionDir": "v20250927-2121-c135834d",
    "baseComponent": "GeneratedComponent",
    "runTimestamp": "2025-09-27T20:21:57.148Z",
    "previousVersionDir": "v20250927-2116-a77e098c",
    "fileHashes": {
      "GeneratedComponent.v1.tsx": "535cac96"
    }
  },
  {
    "versionDir": "v20250927-2121-7095f45c",
    "baseComponent": "GeneratedComponent",
    "runTimestamp": "2025-09-27T20:21:57.155Z",
    "previousVersionDir": "v20250927-2121-c135834d",
    "fileHashes": {
      "GeneratedComponent.v1.tsx": "535cac96"
    }
  },
  {
    "versionDir": "v20250927-2126-fbcae7a5",
    "baseComponent": "GeneratedComponent",
    "runTimestamp": "2025-09-27T20:26:35.322Z",
    "previousVersionDir": "v20250927-2121-7095f45c",
    "fileHashes": {
      "GeneratedComponent.v1.tsx": "535cac96"
    }
  },
  {
    "versionDir": "v20250927-2126-81a9f979",
    "baseComponent": "GeneratedComponent",
    "runTimestamp": "2025-09-27T20:26:35.328Z",
    "previousVersionDir": "v20250927-2126-fbcae7a5",
    "fileHashes": {
      "GeneratedComponent.v1.tsx": "535cac96"
    }
  },
  {
    "versionDir": "v20250928-1353-9222709c",
    "baseComponent": "GeneratedComponent",
    "runTimestamp": "2025-09-28T12:53:57.570Z",
    "previousVersionDir": "v20250927-2126-81a9f979",
    "fileHashes": {
      "GeneratedComponent.v1.tsx": "535cac96"
    }
  },
  {
    "versionDir": "v20250928-1353-b90a7162",
    "baseComponent": "GeneratedComponent",
    "runTimestamp": "2025-09-28T12:53:57.613Z",
    "previousVersionDir": "v20250928-1353-9222709c",
    "fileHashes": {
      "GeneratedComponent.v1.tsx": "535cac96"
    }
  },
  {
    "versionDir": "v20250928-1359-a8699f37",
    "baseComponent": "GeneratedComponent",
    "runTimestamp": "2025-09-28T12:59:23.796Z",
    "previousVersionDir": "v20250928-1353-b90a7162",
    "fileHashes": {
      "GeneratedComponent.v1.tsx": "535cac96"
    }
  },
  {
    "versionDir": "v20250928-1359-a8885730",
    "baseComponent": "GeneratedComponent",
    "runTimestamp": "2025-09-28T12:59:23.869Z",
    "previousVersionDir": "v20250928-1359-a8699f37",
    "fileHashes": {
      "GeneratedComponent.v1.tsx": "535cac96"
    }
  },
  {
    "versionDir": "v20250928-1402-4c81eee3",
    "baseComponent": "GeneratedComponent",
    "runTimestamp": "2025-09-28T13:02:06.494Z",
    "previousVersionDir": "v20250928-1359-a8885730",
    "fileHashes": {
      "GeneratedComponent.v1.tsx": "535cac96"
    }
  },
  {
    "versionDir": "v20250928-1402-1e9d3f72",
    "baseComponent": "GeneratedComponent",
    "runTimestamp": "2025-09-28T13:02:06.521Z",
    "previousVersionDir": "v20250928-1402-4c81eee3",
    "fileHashes": {
      "GeneratedComponent.v1.tsx": "535cac96"
    }
  },
  {
    "versionDir": "v20250928-1403-8135fdb3",
    "baseComponent": "GeneratedComponent",
    "runTimestamp": "2025-09-28T13:03:10.809Z",
    "previousVersionDir": "v20250928-1402-1e9d3f72",
    "fileHashes": {
      "GeneratedComponent.v1.tsx": "535cac96"
    }
  },
  {
    "versionDir": "v20250928-1403-dc87b041",
    "baseComponent": "GeneratedComponent",
    "runTimestamp": "2025-09-28T13:03:10.850Z",
    "previousVersionDir": "v20250928-1403-8135fdb3",
    "fileHashes": {
      "GeneratedComponent.v1.tsx": "535cac96"
    }
  },
  {
    "versionDir": "v20250928-1706-c7b601d5",
    "baseComponent": "GeneratedComponent",
    "runTimestamp": "2025-09-28T16:06:32.647Z",
    "previousVersionDir": "v20250928-1403-dc87b041",
    "fileHashes": {
      "GeneratedComponent.v1.tsx": "535cac96"
    }
  },
  {
    "versionDir": "v20250928-1706-448b80e8",
    "baseComponent": "GeneratedComponent",
    "runTimestamp": "2025-09-28T16:06:32.674Z",
    "previousVersionDir": "v20250928-1706-c7b601d5",
    "fileHashes": {
      "GeneratedComponent.v1.tsx": "535cac96"
    }
  }
]