[
  {
    "versionDir": "v20250929-1450-f616df2b",
    "baseComponent": "GeneratedComponent",
    "runTimestamp": "2025-09-29T14:50:28.502Z",
    "previousVersionDir": null,
    "fileHashes": {
      "GeneratedComponent.v1.tsx": "96b9236d"
    }
  },
  {
    "versionDir": "v20250929-1450-ea41e66a",
    "baseComponent": "GeneratedComponent",
    "runTimestamp": "2025-09-29T14:50:28.504Z",
    "previousVersionDir": "v20250929-1450-f616df2b",
    "fileHashes": {
      "GeneratedComponent.v1.tsx": "96b9236d"
    }
  }
]