[
  {
    "versionDir": "v20250927-2116-0ee25e81",
    "baseComponent": "GeneratedComponent",
    "runTimestamp": "2025-09-27T20:16:34.876Z",
    "previousVersionDir": null,
    "fileHashes": {
      "GeneratedComponent.v1.tsx": "535cac96"
    }
  },
  {
    "versionDir": "v20250927-2121-27d87fff",
    "baseComponent": "GeneratedComponent",
    "runTimestamp": "2025-09-27T20:21:57.422Z",
    "previousVersionDir": "v20250927-2116-0ee25e81",
    "fileHashes": {
      "GeneratedComponent.v1.tsx": "535cac96"
    }
  },
  {
    "versionDir": "v20250927-2126-ac1b2dff",
    "baseComponent": "GeneratedComponent",
    "runTimestamp": "2025-09-27T20:26:34.790Z",
    "previousVersionDir": "v20250927-2121-27d87fff",
    "fileHashes": {
      "GeneratedComponent.v1.tsx": "535cac96"
    }
  },
  {
    "versionDir": "v20250928-1250-10511fa2",
    "baseComponent": "GeneratedComponent",
    "runTimestamp": "2025-09-28T11:50:44.175Z",
    "previousVersionDir": "v20250927-2126-ac1b2dff",
    "fileHashes": {
      "GeneratedComponent.v1.tsx": "535cac96"
    }
  },
  {
    "versionDir": "v20250928-1253-2a17882e",
    "baseComponent": "GeneratedComponent",
    "runTimestamp": "2025-09-28T11:53:15.529Z",
    "previousVersionDir": "v20250928-1250-10511fa2",
    "fileHashes": {
      "GeneratedComponent.v1.tsx": "535cac96"
    }
  },
  {
    "versionDir": "v20250928-1255-3e358b73",
    "baseComponent": "GeneratedComponent",
    "runTimestamp": "2025-09-28T11:55:17.570Z",
    "previousVersionDir": "v20250928-1253-2a17882e",
    "fileHashes": {
      "GeneratedComponent.v1.tsx": "535cac96"
    }
  },
  {
    "versionDir": "v20250928-1255-b8060d1d",
    "baseComponent": "GeneratedComponent",
    "runTimestamp": "2025-09-28T11:55:27.077Z",
    "previousVersionDir": "v20250928-1255-3e358b73",
    "fileHashes": {
      "GeneratedComponent.v1.tsx": "535cac96"
    }
  },
  {
    "versionDir": "v20250928-1255-4cf62091",
    "baseComponent": "GeneratedComponent",
    "runTimestamp": "2025-09-28T11:55:42.900Z",
    "previousVersionDir": "v20250928-1255-b8060d1d",
    "fileHashes": {
      "GeneratedComponent.v1.tsx": "535cac96"
    }
  },
  {
    "versionDir": "v20250928-1256-3b53ef1c",
    "baseComponent": "GeneratedComponent",
    "runTimestamp": "2025-09-28T11:56:06.788Z",
    "previousVersionDir": "v20250928-1255-4cf62091",
    "fileHashes": {
      "GeneratedComponent.v1.tsx": "535cac96"
    }
  },
  {
    "versionDir": "v20250928-1353-21dbbf1f",
    "baseComponent": "GeneratedComponent",
    "runTimestamp": "2025-09-28T12:53:57.930Z",
    "previousVersionDir": "v20250928-1256-3b53ef1c",
    "fileHashes": {
      "GeneratedComponent.v1.tsx": "535cac96"
    }
  },
  {
    "versionDir": "v20250928-1359-ad74aa35",
    "baseComponent": "GeneratedComponent",
    "runTimestamp": "2025-09-28T12:59:25.114Z",
    "previousVersionDir": "v20250928-1353-21dbbf1f",
    "fileHashes": {
      "GeneratedComponent.v1.tsx": "535cac96"
    }
  },
  {
    "versionDir": "v20250928-1402-64888302",
    "baseComponent": "GeneratedComponent",
    "runTimestamp": "2025-09-28T13:02:06.170Z",
    "previousVersionDir": "v20250928-1359-ad74aa35",
    "fileHashes": {
      "GeneratedComponent.v1.tsx": "535cac96"
    }
  },
  {
    "versionDir": "v20250928-1403-ce6574ec",
    "baseComponent": "GeneratedComponent",
    "runTimestamp": "2025-09-28T13:03:11.055Z",
    "previousVersionDir": "v20250928-1402-64888302",
    "fileHashes": {
      "GeneratedComponent.v1.tsx": "535cac96"
    }
  },
  {
    "versionDir": "v20250928-1706-04c577e1",
    "baseComponent": "GeneratedComponent",
    "runTimestamp": "2025-09-28T16:06:33.096Z",
    "previousVersionDir": "v20250928-1403-ce6574ec",
    "fileHashes": {
      "GeneratedComponent.v1.tsx": "535cac96"
    }
  }
]