[
  {
    "versionDir": "v20250927-2116-301ddb31",
    "baseComponent": "GeneratedComponent",
    "runTimestamp": "2025-09-27T20:16:34.443Z",
    "previousVersionDir": null,
    "fileHashes": {
      "GeneratedComponent.v1.tsx": "535cac96"
    }
  },
  {
    "versionDir": "v20250927-2116-1f9b64f9",
    "baseComponent": "GeneratedComponent",
    "runTimestamp": "2025-09-27T20:16:34.451Z",
    "previousVersionDir": "v20250927-2116-301ddb31",
    "fileHashes": {
      "GeneratedComponent.v1.tsx": "535cac96"
    }
  },
  {
    "versionDir": "v20250927-2126-f4028b06",
    "baseComponent": "GeneratedComponent",
    "runTimestamp": "2025-09-27T20:26:34.279Z",
    "previousVersionDir": "v20250927-2116-1f9b64f9",
    "fileHashes": {
      "GeneratedComponent.v1.tsx": "535cac96"
    }
  },
  {
    "versionDir": "v20250927-2126-2a422e71",
    "baseComponent": "GeneratedComponent",
    "runTimestamp": "2025-09-27T20:26:34.292Z",
    "previousVersionDir": "v20250927-2126-f4028b06",
    "fileHashes": {
      "GeneratedComponent.v1.tsx": "535cac96"
    }
  },
  {
    "versionDir": "v20250928-1353-8e3d49d7",
    "baseComponent": "GeneratedComponent",
    "runTimestamp": "2025-09-28T12:53:57.939Z",
    "previousVersionDir": "v20250927-2126-2a422e71",
    "fileHashes": {
      "GeneratedComponent.v1.tsx": "535cac96"
    }
  },
  {
    "versionDir": "v20250928-1353-166370d0",
    "baseComponent": "GeneratedComponent",
    "runTimestamp": "2025-09-28T12:53:57.963Z",
    "previousVersionDir": "v20250928-1353-8e3d49d7",
    "fileHashes": {
      "GeneratedComponent.v1.tsx": "535cac96"
    }
  },
  {
    "versionDir": "v20250928-1359-3fc4c22b",
    "baseComponent": "GeneratedComponent",
    "runTimestamp": "2025-09-28T12:59:24.934Z",
    "previousVersionDir": "v20250928-1353-166370d0",
    "fileHashes": {
      "GeneratedComponent.v1.tsx": "535cac96"
    }
  },
  {
    "versionDir": "v20250928-1359-47fee9ef",
    "baseComponent": "GeneratedComponent",
    "runTimestamp": "2025-09-28T12:59:24.958Z",
    "previousVersionDir": "v20250928-1359-3fc4c22b",
    "fileHashes": {
      "GeneratedComponent.v1.tsx": "535cac96"
    }
  },
  {
    "versionDir": "v20250928-1402-fa6d4212",
    "baseComponent": "GeneratedComponent",
    "runTimestamp": "2025-09-28T13:02:06.615Z",
    "previousVersionDir": "v20250928-1359-47fee9ef",
    "fileHashes": {
      "GeneratedComponent.v1.tsx": "535cac96"
    }
  },
  {
    "versionDir": "v20250928-1402-b2bce371",
    "baseComponent": "GeneratedComponent",
    "runTimestamp": "2025-09-28T13:02:06.662Z",
    "previousVersionDir": "v20250928-1402-fa6d4212",
    "fileHashes": {
      "GeneratedComponent.v1.tsx": "535cac96"
    }
  },
  {
    "versionDir": "v20250928-1403-071850f2",
    "baseComponent": "GeneratedComponent",
    "runTimestamp": "2025-09-28T13:03:10.646Z",
    "previousVersionDir": "v20250928-1402-b2bce371",
    "fileHashes": {
      "GeneratedComponent.v1.tsx": "535cac96"
    }
  },
  {
    "versionDir": "v20250928-1403-7d8275f2",
    "baseComponent": "GeneratedComponent",
    "runTimestamp": "2025-09-28T13:03:10.678Z",
    "previousVersionDir": "v20250928-1403-071850f2",
    "fileHashes": {
      "GeneratedComponent.v1.tsx": "535cac96"
    }
  },
  {
    "versionDir": "v20250928-1706-a7c8c761",
    "baseComponent": "GeneratedComponent",
    "runTimestamp": "2025-09-28T16:06:32.733Z",
    "previousVersionDir": "v20250928-1403-7d8275f2",
    "fileHashes": {
      "GeneratedComponent.v1.tsx": "535cac96"
    }
  },
  {
    "versionDir": "v20250928-1706-c0ff63f0",
    "baseComponent": "GeneratedComponent",
    "runTimestamp": "2025-09-28T16:06:32.745Z",
    "previousVersionDir": "v20250928-1706-a7c8c761",
    "fileHashes": {
      "GeneratedComponent.v1.tsx": "535cac96"
    }
  },
  {
    "versionDir": "v20250929-1448-39ba6322",
    "baseComponent": "GeneratedComponent",
    "runTimestamp": "2025-09-29T14:48:33.995Z",
    "previousVersionDir": "v20250928-1706-c0ff63f0",
    "fileHashes": {
      "GeneratedComponent.v1.tsx": "535cac96"
    }
  },
  {
    "versionDir": "v20250929-1448-66c3a423",
    "baseComponent": "GeneratedComponent",
    "runTimestamp": "2025-09-29T14:48:33.997Z",
    "previousVersionDir": "v20250929-1448-39ba6322",
    "fileHashes": {
      "GeneratedComponent.v1.tsx": "535cac96"
    }
  },
  {
    "versionDir": "v20250929-1450-d4432600",
    "baseComponent": "GeneratedComponent",
    "runTimestamp": "2025-09-29T14:50:28.901Z",
    "previousVersionDir": "v20250929-1448-66c3a423",
    "fileHashes": {
      "GeneratedComponent.v1.tsx": "535cac96"
    }
  },
  {
    "versionDir": "v20250929-1450-ebe53e1b",
    "baseComponent": "GeneratedComponent",
    "runTimestamp": "2025-09-29T14:50:28.904Z",
    "previousVersionDir": "v20250929-1450-d4432600",
    "fileHashes": {
      "GeneratedComponent.v1.tsx": "535cac96"
    }
  }
]