[
  {
    "versionDir": "v20250927-2103-3b970f9b",
    "baseComponent": "GeneratedComponent",
    "runTimestamp": "2025-09-27T20:03:07.413Z",
    "previousVersionDir": null,
    "fileHashes": {
      "GeneratedComponent.v1.tsx": "71b3c1c6"
    }
  },
  {
    "versionDir": "v20250927-2126-e6560440",
    "baseComponent": "GeneratedComponent",
    "runTimestamp": "2025-09-27T20:26:35.284Z",
    "previousVersionDir": "v20250927-2103-3b970f9b",
    "fileHashes": {
      "GeneratedComponent.v1.tsx": "71b3c1c6"
    }
  },
  {
    "versionDir": "v20250928-1353-86936d15",
    "baseComponent": "GeneratedComponent",
    "runTimestamp": "2025-09-28T12:53:57.832Z",
    "previousVersionDir": "v20250927-2126-e6560440",
    "fileHashes": {
      "GeneratedComponent.v1.tsx": "71b3c1c6"
    }
  },
  {
    "versionDir": "v20250928-1359-6b3e2f00",
    "baseComponent": "GeneratedComponent",
    "runTimestamp": "2025-09-28T12:59:24.093Z",
    "previousVersionDir": "v20250928-1353-86936d15",
    "fileHashes": {
      "GeneratedComponent.v1.tsx": "71b3c1c6"
    }
  },
  {
    "versionDir": "v20250928-1402-e6fba64f",
    "baseComponent": "GeneratedComponent",
    "runTimestamp": "2025-09-28T13:02:06.090Z",
    "previousVersionDir": "v20250928-1359-6b3e2f00",
    "fileHashes": {
      "GeneratedComponent.v1.tsx": "71b3c1c6"
    }
  },
  {
    "versionDir": "v20250928-1403-b897c4be",
    "baseComponent": "GeneratedComponent",
    "runTimestamp": "2025-09-28T13:03:11.023Z",
    "previousVersionDir": "v20250928-1402-e6fba64f",
    "fileHashes": {
      "GeneratedComponent.v1.tsx": "71b3c1c6"
    }
  },
  {
    "versionDir": "v20250928-1706-cccdfaed",
    "baseComponent": "GeneratedComponent",
    "runTimestamp": "2025-09-28T16:06:32.759Z",
    "previousVersionDir": "v20250928-1403-b897c4be",
    "fileHashes": {
      "GeneratedComponent.v1.tsx": "71b3c1c6"
    }
  }
]