[
  {
    "versionDir": "v20250927-2103-fc0c073a",
    "baseComponent": "GeneratedComponent",
    "runTimestamp": "2025-09-27T20:03:07.425Z",
    "previousVersionDir": null,
    "fileHashes": {
      "GeneratedComponent.v1.tsx": "f596aad0"
    }
  },
  {
    "versionDir": "v20250927-2126-ad4678a4",
    "baseComponent": "GeneratedComponent",
    "runTimestamp": "2025-09-27T20:26:35.030Z",
    "previousVersionDir": "v20250927-2103-fc0c073a",
    "fileHashes": {
      "GeneratedComponent.v1.tsx": "f596aad0"
    }
  },
  {
    "versionDir": "v20250928-1353-eccdcfcd",
    "baseComponent": "GeneratedComponent",
    "runTimestamp": "2025-09-28T12:53:57.377Z",
    "previousVersionDir": "v20250927-2126-ad4678a4",
    "fileHashes": {
      "GeneratedComponent.v1.tsx": "f596aad0"
    }
  },
  {
    "versionDir": "v20250928-1359-ac8e637b",
    "baseComponent": "GeneratedComponent",
    "runTimestamp": "2025-09-28T12:59:24.471Z",
    "previousVersionDir": "v20250928-1353-eccdcfcd",
    "fileHashes": {
      "GeneratedComponent.v1.tsx": "f596aad0"
    }
  },
  {
    "versionDir": "v20250928-1402-45514047",
    "baseComponent": "GeneratedComponent",
    "runTimestamp": "2025-09-28T13:02:06.571Z",
    "previousVersionDir": "v20250928-1359-ac8e637b",
    "fileHashes": {
      "GeneratedComponent.v1.tsx": "f596aad0"
    }
  },
  {
    "versionDir": "v20250928-1403-cd9ac065",
    "baseComponent": "GeneratedComponent",
    "runTimestamp": "2025-09-28T13:03:11.162Z",
    "previousVersionDir": "v20250928-1402-45514047",
    "fileHashes": {
      "GeneratedComponent.v1.tsx": "f596aad0"
    }
  },
  {
    "versionDir": "v20250928-1706-dfa8cbdc",
    "baseComponent": "GeneratedComponent",
    "runTimestamp": "2025-09-28T16:06:32.607Z",
    "previousVersionDir": "v20250928-1403-cd9ac065",
    "fileHashes": {
      "GeneratedComponent.v1.tsx": "f596aad0"
    }
  },
  {
    "versionDir": "v20250929-1448-b143501b",
    "baseComponent": "GeneratedComponent",
    "runTimestamp": "2025-09-29T14:48:32.882Z",
    "previousVersionDir": "v20250928-1706-dfa8cbdc",
    "fileHashes": {
      "GeneratedComponent.v1.tsx": "f596aad0"
    }
  },
  {
    "versionDir": "v20250929-1450-d86ec209",
    "baseComponent": "GeneratedComponent",
    "runTimestamp": "2025-09-29T14:50:28.413Z",
    "previousVersionDir": "v20250929-1448-b143501b",
    "fileHashes": {
      "GeneratedComponent.v1.tsx": "f596aad0"
    }
  }
]