[
  {
    "versionDir": "v20250927-2126-d16e74b7",
    "baseComponent": "GeneratedComponent",
    "runTimestamp": "2025-09-27T20:26:34.447Z",
    "previousVersionDir": null,
    "fileHashes": {
      "GeneratedComponent.v1.tsx": "b6a2b1e0"
    }
  },
  {
    "versionDir": "v20250928-1353-e1eb07ba",
    "baseComponent": "GeneratedComponent",
    "runTimestamp": "2025-09-28T12:53:57.029Z",
    "previousVersionDir": "v20250927-2126-d16e74b7",
    "fileHashes": {
      "GeneratedComponent.v1.tsx": "b6a2b1e0"
    }
  },
  {
    "versionDir": "v20250928-1359-4bf0131b",
    "baseComponent": "GeneratedComponent",
    "runTimestamp": "2025-09-28T12:59:24.746Z",
    "previousVersionDir": "v20250928-1353-e1eb07ba",
    "fileHashes": {
      "GeneratedComponent.v1.tsx": "b6a2b1e0"
    }
  },
  {
    "versionDir": "v20250928-1402-27c4c7e1",
    "baseComponent": "GeneratedComponent",
    "runTimestamp": "2025-09-28T13:02:06.588Z",
    "previousVersionDir": "v20250928-1359-4bf0131b",
    "fileHashes": {
      "GeneratedComponent.v1.tsx": "b6a2b1e0"
    }
  },
  {
    "versionDir": "v20250928-1403-a2ca200d",
    "baseComponent": "GeneratedComponent",
    "runTimestamp": "2025-09-28T13:03:11.492Z",
    "previousVersionDir": "v20250928-1402-27c4c7e1",
    "fileHashes": {
      "GeneratedComponent.v1.tsx": "b6a2b1e0"
    }
  },
  {
    "versionDir": "v20250928-1706-e485f733",
    "baseComponent": "GeneratedComponent",
    "runTimestamp": "2025-09-28T16:06:32.412Z",
    "previousVersionDir": "v20250928-1403-a2ca200d",
    "fileHashes": {
      "GeneratedComponent.v1.tsx": "b6a2b1e0"
    }
  },
  {
    "versionDir": "v20250929-1448-10369711",
    "baseComponent": "GeneratedComponent",
    "runTimestamp": "2025-09-29T14:48:32.930Z",
    "previousVersionDir": "v20250928-1706-e485f733",
    "fileHashes": {
      "GeneratedComponent.v1.tsx": "b6a2b1e0"
    }
  },
  {
    "versionDir": "v20250929-1450-a3485a9a",
    "baseComponent": "GeneratedComponent",
    "runTimestamp": "2025-09-29T14:50:28.336Z",
    "previousVersionDir": "v20250929-1448-10369711",
    "fileHashes": {
      "GeneratedComponent.v1.tsx": "b6a2b1e0"
    }
  }
]