[
  {
    "versionDir": "v20250927-2045-7c5450cc",
    "baseComponent": "GeneratedComponent",
    "runTimestamp": "2025-09-27T19:45:42.118Z",
    "previousVersionDir": null,
    "fileHashes": {
      "GeneratedComponent.v1.tsx": "88eaa5f9"
    }
  },
  {
    "versionDir": "v20250927-2059-013e461e",
    "baseComponent": "GeneratedComponent",
    "runTimestamp": "2025-09-27T19:59:48.233Z",
    "previousVersionDir": "v20250927-2045-7c5450cc",
    "fileHashes": {
      "GeneratedComponent.v1.tsx": "88eaa5f9"
    }
  },
  {
    "versionDir": "v20250927-2126-d2017930",
    "baseComponent": "GeneratedComponent",
    "runTimestamp": "2025-09-27T20:26:34.898Z",
    "previousVersionDir": "v20250927-2059-013e461e",
    "fileHashes": {
      "GeneratedComponent.v1.tsx": "88eaa5f9"
    }
  },
  {
    "versionDir": "v20250928-1353-681c8599",
    "baseComponent": "GeneratedComponent",
    "runTimestamp": "2025-09-28T12:53:58.365Z",
    "previousVersionDir": "v20250927-2126-d2017930",
    "fileHashes": {
      "GeneratedComponent.v1.tsx": "88eaa5f9"
    }
  },
  {
    "versionDir": "v20250928-1359-3867edd1",
    "baseComponent": "GeneratedComponent",
    "runTimestamp": "2025-09-28T12:59:24.941Z",
    "previousVersionDir": "v20250928-1353-681c8599",
    "fileHashes": {
      "GeneratedComponent.v1.tsx": "88eaa5f9"
    }
  },
  {
    "versionDir": "v20250928-1402-72fbce8e",
    "baseComponent": "GeneratedComponent",
    "runTimestamp": "2025-09-28T13:02:06.614Z",
    "previousVersionDir": "v20250928-1359-3867edd1",
    "fileHashes": {
      "GeneratedComponent.v1.tsx": "88eaa5f9"
    }
  },
  {
    "versionDir": "v20250928-1403-ffc2a8af",
    "baseComponent": "GeneratedComponent",
    "runTimestamp": "2025-09-28T13:03:11.205Z",
    "previousVersionDir": "v20250928-1402-72fbce8e",
    "fileHashes": {
      "GeneratedComponent.v1.tsx": "88eaa5f9"
    }
  },
  {
    "versionDir": "v20250928-1706-93042fb2",
    "baseComponent": "GeneratedComponent",
    "runTimestamp": "2025-09-28T16:06:32.901Z",
    "previousVersionDir": "v20250928-1403-ffc2a8af",
    "fileHashes": {
      "GeneratedComponent.v1.tsx": "88eaa5f9"
    }
  },
  {
    "versionDir": "v20250929-1448-5af051b1",
    "baseComponent": "GeneratedComponent",
    "runTimestamp": "2025-09-29T14:48:34.456Z",
    "previousVersionDir": "v20250928-1706-93042fb2",
    "fileHashes": {
      "GeneratedComponent.v1.tsx": "88eaa5f9"
    }
  },
  {
    "versionDir": "v20250929-1450-b4542590",
    "baseComponent": "GeneratedComponent",
    "runTimestamp": "2025-09-29T14:50:28.747Z",
    "previousVersionDir": "v20250929-1448-5af051b1",
    "fileHashes": {
      "GeneratedComponent.v1.tsx": "88eaa5f9"
    }
  },
  {
    "versionDir": "v20250929-1547-6b5e5650",
    "baseComponent": "GeneratedComponent",
    "runTimestamp": "2025-09-29T15:47:46.482Z",
    "previousVersionDir": "v20250929-1450-b4542590",
    "fileHashes": {
      "GeneratedComponent.v1.tsx": "88eaa5f9"
    }
  }
]