[
  {
    "versionDir": "v20250927-2116-d603a0c5",
    "baseComponent": "GeneratedComponent",
    "runTimestamp": "2025-09-27T20:16:34.566Z",
    "previousVersionDir": null,
    "fileHashes": {
      "GeneratedComponent.v1.tsx": "535cac96"
    }
  },
  {
    "versionDir": "v20250927-2116-fc4e9859",
    "baseComponent": "GeneratedComponent",
    "runTimestamp": "2025-09-27T20:16:34.571Z",
    "previousVersionDir": "v20250927-2116-d603a0c5",
    "fileHashes": {
      "GeneratedComponent.v1.tsx": "535cac96"
    }
  },
  {
    "versionDir": "v20250927-2121-905ba8f6",
    "baseComponent": "GeneratedComponent",
    "runTimestamp": "2025-09-27T20:21:56.934Z",
    "previousVersionDir": "v20250927-2116-fc4e9859",
    "fileHashes": {
      "GeneratedComponent.v1.tsx": "535cac96"
    }
  },
  {
    "versionDir": "v20250927-2121-017b0ffa",
    "baseComponent": "GeneratedComponent",
    "runTimestamp": "2025-09-27T20:21:56.941Z",
    "previousVersionDir": "v20250927-2121-905ba8f6",
    "fileHashes": {
      "GeneratedComponent.v1.tsx": "535cac96"
    }
  },
  {
    "versionDir": "v20250927-2124-1a095740",
    "baseComponent": "GeneratedComponent",
    "runTimestamp": "2025-09-27T20:24:41.435Z",
    "previousVersionDir": "v20250927-2121-017b0ffa",
    "fileHashes": {
      "GeneratedComponent.v1.tsx": "535cac96"
    }
  },
  {
    "versionDir": "v20250927-2124-eadad7a9",
    "baseComponent": "GeneratedComponent",
    "runTimestamp": "2025-09-27T20:24:41.440Z",
    "previousVersionDir": "v20250927-2124-1a095740",
    "fileHashes": {
      "GeneratedComponent.v1.tsx": "535cac96"
    }
  },
  {
    "versionDir": "v20250927-2126-58cc50ea",
    "baseComponent": "GeneratedComponent",
    "runTimestamp": "2025-09-27T20:26:34.437Z",
    "previousVersionDir": "v20250927-2124-eadad7a9",
    "fileHashes": {
      "GeneratedComponent.v1.tsx": "535cac96"
    }
  },
  {
    "versionDir": "v20250927-2126-ff113ab5",
    "baseComponent": "GeneratedComponent",
    "runTimestamp": "2025-09-27T20:26:34.444Z",
    "previousVersionDir": "v20250927-2126-58cc50ea",
    "fileHashes": {
      "GeneratedComponent.v1.tsx": "535cac96"
    }
  },
  {
    "versionDir": "v20250928-1250-740d9065",
    "baseComponent": "GeneratedComponent",
    "runTimestamp": "2025-09-28T11:50:44.183Z",
    "previousVersionDir": "v20250927-2126-ff113ab5",
    "fileHashes": {
      "GeneratedComponent.v1.tsx": "535cac96"
    }
  },
  {
    "versionDir": "v20250928-1250-db9ea7fd",
    "baseComponent": "GeneratedComponent",
    "runTimestamp": "2025-09-28T11:50:44.194Z",
    "previousVersionDir": "v20250928-1250-740d9065",
    "fileHashes": {
      "GeneratedComponent.v1.tsx": "535cac96"
    }
  },
  {
    "versionDir": "v20250928-1253-84cf8619",
    "baseComponent": "GeneratedComponent",
    "runTimestamp": "2025-09-28T11:53:15.446Z",
    "previousVersionDir": "v20250928-1250-db9ea7fd",
    "fileHashes": {
      "GeneratedComponent.v1.tsx": "535cac96"
    }
  },
  {
    "versionDir": "v20250928-1253-c510040b",
    "baseComponent": "GeneratedComponent",
    "runTimestamp": "2025-09-28T11:53:15.452Z",
    "previousVersionDir": "v20250928-1253-84cf8619",
    "fileHashes": {
      "GeneratedComponent.v1.tsx": "535cac96"
    }
  },
  {
    "versionDir": "v20250928-1255-69a007d2",
    "baseComponent": "GeneratedComponent",
    "runTimestamp": "2025-09-28T11:55:27.538Z",
    "previousVersionDir": "v20250928-1253-c510040b",
    "fileHashes": {
      "GeneratedComponent.v1.tsx": "535cac96"
    }
  },
  {
    "versionDir": "v20250928-1255-7cea0029",
    "baseComponent": "GeneratedComponent",
    "runTimestamp": "2025-09-28T11:55:27.544Z",
    "previousVersionDir": "v20250928-1255-69a007d2",
    "fileHashes": {
      "GeneratedComponent.v1.tsx": "535cac96"
    }
  },
  {
    "versionDir": "v20250928-1255-653f5c6f",
    "baseComponent": "GeneratedComponent",
    "runTimestamp": "2025-09-28T11:55:42.890Z",
    "previousVersionDir": "v20250928-1255-7cea0029",
    "fileHashes": {
      "GeneratedComponent.v1.tsx": "535cac96"
    }
  },
  {
    "versionDir": "v20250928-1255-24f91469",
    "baseComponent": "GeneratedComponent",
    "runTimestamp": "2025-09-28T11:55:42.895Z",
    "previousVersionDir": "v20250928-1255-653f5c6f",
    "fileHashes": {
      "GeneratedComponent.v1.tsx": "535cac96"
    }
  },
  {
    "versionDir": "v20250928-1256-f1747ac8",
    "baseComponent": "GeneratedComponent",
    "runTimestamp": "2025-09-28T11:56:06.759Z",
    "previousVersionDir": "v20250928-1255-24f91469",
    "fileHashes": {
      "GeneratedComponent.v1.tsx": "535cac96"
    }
  },
  {
    "versionDir": "v20250928-1256-412a5b64",
    "baseComponent": "GeneratedComponent",
    "runTimestamp": "2025-09-28T11:56:06.769Z",
    "previousVersionDir": "v20250928-1256-f1747ac8",
    "fileHashes": {
      "GeneratedComponent.v1.tsx": "535cac96"
    }
  },
  {
    "versionDir": "v20250928-1353-244ef533",
    "baseComponent": "GeneratedComponent",
    "runTimestamp": "2025-09-28T12:53:58.785Z",
    "previousVersionDir": "v20250928-1256-412a5b64",
    "fileHashes": {
      "GeneratedComponent.v1.tsx": "535cac96"
    }
  },
  {
    "versionDir": "v20250928-1353-e1ff4932",
    "baseComponent": "GeneratedComponent",
    "runTimestamp": "2025-09-28T12:53:58.793Z",
    "previousVersionDir": "v20250928-1353-244ef533",
    "fileHashes": {
      "GeneratedComponent.v1.tsx": "535cac96"
    }
  },
  {
    "versionDir": "v20250928-1359-62c388c2",
    "baseComponent": "GeneratedComponent",
    "runTimestamp": "2025-09-28T12:59:24.045Z",
    "previousVersionDir": "v20250928-1353-e1ff4932",
    "fileHashes": {
      "GeneratedComponent.v1.tsx": "535cac96"
    }
  },
  {
    "versionDir": "v20250928-1359-c60bf779",
    "baseComponent": "GeneratedComponent",
    "runTimestamp": "2025-09-28T12:59:24.095Z",
    "previousVersionDir": "v20250928-1359-62c388c2",
    "fileHashes": {
      "GeneratedComponent.v1.tsx": "535cac96"
    }
  },
  {
    "versionDir": "v20250928-1402-b430954c",
    "baseComponent": "GeneratedComponent",
    "runTimestamp": "2025-09-28T13:02:05.834Z",
    "previousVersionDir": "v20250928-1359-c60bf779",
    "fileHashes": {
      "GeneratedComponent.v1.tsx": "535cac96"
    }
  },
  {
    "versionDir": "v20250928-1402-2094dfbf",
    "baseComponent": "GeneratedComponent",
    "runTimestamp": "2025-09-28T13:02:05.846Z",
    "previousVersionDir": "v20250928-1402-b430954c",
    "fileHashes": {
      "GeneratedComponent.v1.tsx": "535cac96"
    }
  },
  {
    "versionDir": "v20250928-1403-d6b64dca",
    "baseComponent": "GeneratedComponent",
    "runTimestamp": "2025-09-28T13:03:10.560Z",
    "previousVersionDir": "v20250928-1402-2094dfbf",
    "fileHashes": {
      "GeneratedComponent.v1.tsx": "535cac96"
    }
  },
  {
    "versionDir": "v20250928-1403-041e8d67",
    "baseComponent": "GeneratedComponent",
    "runTimestamp": "2025-09-28T13:03:10.582Z",
    "previousVersionDir": "v20250928-1403-d6b64dca",
    "fileHashes": {
      "GeneratedComponent.v1.tsx": "535cac96"
    }
  },
  {
    "versionDir": "v20250928-1706-51de4a88",
    "baseComponent": "GeneratedComponent",
    "runTimestamp": "2025-09-28T16:06:33.063Z",
    "previousVersionDir": "v20250928-1403-041e8d67",
    "fileHashes": {
      "GeneratedComponent.v1.tsx": "535cac96"
    }
  },
  {
    "versionDir": "v20250928-1706-5be1367f",
    "baseComponent": "GeneratedComponent",
    "runTimestamp": "2025-09-28T16:06:33.079Z",
    "previousVersionDir": "v20250928-1706-51de4a88",
    "fileHashes": {
      "GeneratedComponent.v1.tsx": "535cac96"
    }
  },
  {
    "versionDir": "v20250929-1448-e1fe5437",
    "baseComponent": "GeneratedComponent",
    "runTimestamp": "2025-09-29T14:48:33.418Z",
    "previousVersionDir": "v20250928-1706-5be1367f",
    "fileHashes": {
      "GeneratedComponent.v1.tsx": "535cac96"
    }
  },
  {
    "versionDir": "v20250929-1448-1009beda",
    "baseComponent": "GeneratedComponent",
    "runTimestamp": "2025-09-29T14:48:33.428Z",
    "previousVersionDir": "v20250929-1448-e1fe5437",
    "fileHashes": {
      "GeneratedComponent.v1.tsx": "535cac96"
    }
  },
  {
    "versionDir": "v20250929-1450-5fc11d1f",
    "baseComponent": "GeneratedComponent",
    "runTimestamp": "2025-09-29T14:50:28.332Z",
    "previousVersionDir": "v20250929-1448-1009beda",
    "fileHashes": {
      "GeneratedComponent.v1.tsx": "535cac96"
    }
  },
  {
    "versionDir": "v20250929-1450-84b1b1ab",
    "baseComponent": "GeneratedComponent",
    "runTimestamp": "2025-09-29T14:50:28.342Z",
    "previousVersionDir": "v20250929-1450-5fc11d1f",
    "fileHashes": {
      "GeneratedComponent.v1.tsx": "535cac96"
    }
  },
  {
    "versionDir": "v20250929-1547-3a6bac13",
    "baseComponent": "GeneratedComponent",
    "runTimestamp": "2025-09-29T15:47:45.091Z",
    "previousVersionDir": "v20250929-1450-84b1b1ab",
    "fileHashes": {
      "GeneratedComponent.v1.tsx": "535cac96"
    }
  },
  {
    "versionDir": "v20250929-1547-fa70f8cd",
    "baseComponent": "GeneratedComponent",
    "runTimestamp": "2025-09-29T15:47:45.094Z",
    "previousVersionDir": "v20250929-1547-3a6bac13",
    "fileHashes": {
      "GeneratedComponent.v1.tsx": "535cac96"
    }
  }
]